<?xml version="1.0" encoding="UTF-8" ?>
<xs:schema xmlns:xs="http://www.w3.org/2001/XMLSchema">
    <xs:complexType name="TermType" >
        <xs:sequence>
            <xs:element name="termName" type="xs:string"/>
            <xs:element name="startDate" type="xs:date"/>
            <xs:element name="endDate" type="xs:date"/>
        </xs:sequence>
        <xs:attribute name="id" type="xs:long" use="required"/>
    </xs:complexType>
    <xs:complexType name="TermsListType">
        <xs:sequence>
            <xs:element name="term" type="TermType" minOccurs="0" maxOccurs="unbounded"/>
        </xs:sequence>
    </xs:complexType>
    <xs:element name="termsList" type="TermsListType"/>
</xs:schema>